export const MOCK_PHOTOS = [
    {
        id: '1',
        url: '/nikita/2026-01-12/photo_2026-01-12_21-32-03.jpg',
        date: '12.01.2026',
        description: 'Солдат свега',
    },
    {
        id: '2',
        url: '/nikita/2025-06-27/photo_2025-06-27_00-19-11.jpg',
        date: '27.06.2025',
        description: 'Пожилой причесон',
    },
    {
        id: '3',
        url: '/nikita/2025-06-15/photo_2025-06-15_22-30-11 (2).jpg',
        date: '15.06.2025',
        description: 'коцник',
        modalUrl: '/nikita/2025-06-15/photo_2025-06-15_22-30-11.jpg'
    },
    {
        id: '4',
        url: '/nikita/01.05.2025/01.05.2025.png',
        date: '01.05.2025',
        description: 'Отдых молодцых',
        modalUrl: '/nikita/20.04.2025.png'
    },
    {
        id: '5',
        url: '/nikita/2025-03-31/photo_2025-03-31_03-31-07.jpg',
        date: '31.03.2025',
        description: 'Воссоединение хамахи DAO',
    },
    {
        id: '6',
        url: '/nikita/09.02.2025.png',
        date: '09.02.2025',
        description: 'Воссоединение хамахи DAO',
    },
    {
        id: '7',
        url: '/nikita/31.12.2024.png',
        date: '31.12.2024',
        description: 'Новый год',
        videoUrl: '/nikita/202601302141.mp4',
    },
    {
        id: '8',
        url: '/nikita/2024-12-03/photo_2024-12-03_19-55-11.jpg',
        date: '03.12.2024',
        description: 'туса у децела дома',
    },
    {
        id: '9',
        url: '/nikita/2024-02-21/photo_2024-02-21_00-14-13.jpg',
        date: '21.02.2024',
        description: 'яйца',
    },
    {
        id: '10',
        url: '/nikita/2024-02-20/photo_2024-02-20_14-53-49.jpg',
        date: '20.02.2024',
        description: 'с богдей',
    },
    {
        id: '11',
        url: '/nikita/2024-02-05/photo_2024-02-05_15-57-13.jpg',
        date: '05.02.2024',
        description: 'Днюха)',
        videoUrl: '/nikita/05.02.2024/05.02.2024.MOV',
    },
    {
        id: '12',
        url: '/nikita/2024-01-31/photo_2024-01-31_22-45-55.jpg',
        date: '31.01.2024',
        description: 'Боб Марли',
    },
    {
        id: '13',
        url: '/nikita/2023-10-05/photo_2023-10-05_15-18-42.jpg',
        date: '05.10.2023',
        description: 'добрый вайб',
    },
    {
        id: '14',
        url: '/nikita/2023-09-19/photo_2023-09-19_11-34-20.jpg',
        date: '19.09.2023',
        description: 'кухонные посиделки',
        videoUrl: '/nikita/20.09.2023.MOV',
    },
    {
        id: '15',
        url: '/nikita/2023-09-12/photo_2023-09-12_16-54-46.jpg',
        date: '12.09.2023',
        description: 'она слушает дефтооооунс',
        modalUrl: '/nikita/2023-09-12/photo_2023-09-12_17-06-21.jpg',
    },
    {
        id: '16',
        url: '/nikita/2023-09-10/photo_2023-09-10_23-55-11.jpg',
        date: '10.09.2023',
        description: 'курсед курсед я твой фанат',
    },
    {
        id: '17',
        url: '/nikita/2023-09-02/photo_2023-09-02_11-28-35.jpg',
        date: '02.09.2023',
        description: 'дебильный вайб',
        videoUrl: '/nikita/31.03.2023.MOV',
    },
    {
        id: '18',
        url: '/nikita/2023-08-19/photo_2023-08-19_13-18-48 (2).jpg',
        date: '19.08.2023',
        description: 'типичная вечеринка с бассейном',
        modalUrl: '/nikita/2023-08-19/photo_2023-08-19_13-18-48.jpg',
    },
    {
        id: '19',
        url: '/nikita/2023-07-19/photo_2023-07-19_08-06-17.jpg',
        date: '19.07.2023',
        description: 'перекличка',
    },
    {
        id: '20',
        url: '/nikita/2023-07-27/photo_2023-07-27_12-16-01.jpg',
        date: '27.07.2023',
        description: 'дрейн',
    },
    {
        id: '21',
        url: '/nikita/2023-07-14/photo_2023-07-14_01-10-41.jpg',
        date: '14.07.2023',
        description: 'шляпки',
        modalUrl: '/nikita/2023-07-14/photo_2023-07-14_01-10-43.jpg',
    },
    {
        id: '22',
        url: '/nikita/2023-04-29/photo_2023-04-29_01-23-46.jpg',
        date: '29.04.2023',
        description: 'омайгад',
        videoUrl: '/nikita/mell.mp4',
    },
    {
        id: '23',
        url: '/nikita/2023-04-04/photo_2023-04-04_23-58-24.jpg',
        date: '04.04.2023',
        description: 'банан',
    },
    {
        id: '24',
        url: '/nikita/2023-03-29/photo_2023-03-29_15-50-40.jpg',
        date: '29.03.2023',
        description: 'бушта',
    },
    {
        id: '25',
        url: '/nikita/2023-03-27/photo_2023-03-27_14-24-51.jpg',
        date: '27.03.2023',
        description: 'открывашка',
        videoUrl: '/nikita/27.03.2023.MOV',
    },
    {
        id: '26',
        url: '/nikita/2023-03-20/photo_2023-03-20_19-20-25.jpg',
        date: '20.03.2023',
        description: 'зоопарк',
        modalUrl: '/nikita/2023-03-20/photo_2023-03-20_19-25-31.jpg',
    },
    {
        id: '27',
        url: '/nikita/2023-03-19/photo_2023-03-19_20-02-46.jpg',
        date: '19.03.2023',
        description: 'дебилистика 2',
        videoUrl: '/nikita/02.09.2023.MOV',
    },
    {
        id: '28',
        url: '/nikita/maxresdefault.jpg',
        date: '10.03.2023',
        description: 'Михал Палыч',
        videoUrl: '/nikita/11.03.2023.MOV',
    },
    {
        id: '29',
        url: '/nikita/2023-03-08/photo_2023-03-08_22-24-20.jpg',
        date: '08.03.2023',
        description: 'англия',
        modalUrl: '/nikita/2023-03-08/photo_2023-03-08_22-33-26.jpg',
    },
    {
        id: '30',
        url: '/nikita/2023-03-08/photo_2023-03-08_22-26-56.jpg',
        date: '08.03.2023',
        description: 'верис май майнд',
        videoUrl: '/nikita/08.03.2023.MOV',
    },
    {
        id: '31',
        url: '/nikita/photo_2023-03-03_21-25-47.jpg',
        date: '03.03.2023',
        description: 'пизанская башня',
        modalUrl: '/nikita/photo_2023-03-03_21-25-49.jpg',
    },
    {
        id: '32',
        url: '/nikita/2023-03-04/photo_2023-03-04_15-13-38.jpg',
        date: '04.03.2023',
        description: 'hmmmm...?',
    },
    {
        id: '33',
        url: '/nikita/2023-03-03/photo_2023-03-03_21-26-04.jpg',
        date: '03.03.2023',
        description: 'спортивное начло',
        videoUrl: '/nikita/2023-03-03/03.03.2023.MOV',
    },
    {
        id: '34',
        url: '/nikita/2023-02-26/photo_2023-02-26_22-03-31.jpg',
        date: '26.02.2023',
        description: 'кастрюля МОБ',
        modalUrl: '/nikita/2023-02-26/photo_2023-02-26_22-03-46.jpg',
    },
    {
        id: '35',
        url: '/nikita/2023-02-05/photo_2023-02-05_12-36-18.jpg',
        date: '05.02.2023',
        description: 'туса',
        modalUrl: '/nikita/2023-02-05/photo_2023-02-05_12-36-23.jpg',
    },
    {
        id: '36',
        url: '/nikita/2022-10-30/photo_2022-10-30_20-07-39.jpg',
        date: '30.10.2022',
        description: 'депутат',
        modalUrl: '/nikita/2022-10-30/photo_2022-10-30_20-07-36.jpg',
    },
    {
        id: '37',
        url: '/nikita/2022-09-29/photo_2022-09-29_22-42-48.jpg',
        date: '29.09.2022',
        description: 'стадионная расчиловка',
        modalUrl: '/nikita/2022-09-29/photo_2022-09-29_22-42-50.jpg',
    },
    {
        id: '38',
        url: '/nikita/2022-09-12/photo_2022-09-12_22-42-19.jpg',
        date: '12.09.2022',
        description: 'день города',
    },
    {
        id: '39',
        url: '/nikita/2022-09-09/photo_2022-09-09_14-43-41.jpg',
        date: '09.09.2022',
        description: 'чарон бейби',
    },
    {
        id: '40',
        url: '/nikita/2022-09-08/photo_2022-09-08_23-21-08.jpg',
        date: '08.09.2022',
        description: 'телеканал золотой дождь',
        modalUrl: '/nikita/2022-09-08/photo_2022-09-08_21-29-30.jpg',
    },
    {
        id: '41',
        url: '/nikita/2022-09-01/photo_2022-09-01_06-54-11 (2).jpg',
        date: '01.09.2022',
        description: 'последний день лета',
        modalUrl: '/nikita/2022-09-01/photo_2022-09-01_06-54-11.jpg',
    },
    {
        id: '42',
        url: '/nikita/2022-09-01/photo_2022-09-01_10-19-22.jpg',
        date: '01.09.2022',
        description: 'снова в школу',
        modalUrl: '/nikita/2022-09-01/photo_2022-09-01_10-29-53.jpg',
    },
    {
        id: '43',
        url: '/nikita/2022-08-26/photo_2022-08-26_20-42-49.jpg',
        date: '26.08.2022',
        description: 'крутяк',
    },
    {
        id: '44',
        url: '/nikita/2022-08-15/photo_2022-08-15_08-48-13.jpg',
        date: '15.08.2022',
        description: 'купи купи',
    },
    {
        id: '45',
        url: '/nikita/2022-08-09/photo_2022-08-09_08-56-48.jpg',
        date: '09.08.2022',
        description: 'Moscow never sleep',
        modalUrl: '/nikita/2022-08-05/photo_2022-08-05_18-55-00.jpg',
    },
    {
        id: '46',
        url: '/nikita/2022-08-04/photo_2022-08-04_22-39-56.jpg',
        date: '04.08.2022',
        description: 'стоит молодой',
    },
    {
        id: '47',
        url: '/nikita/2022-06-15/photo_2022-06-15_11-45-47.jpg',
        date: '15.06.2022',
        description: 'хайпует плесень',
        modalUrl: '/nikita/2022-06-15/photo_2022-06-15_11-45-47 (2).jpg',
    },
];

